[
  {
    "schema_version": "1.0",
    "action_id": "11111111-1111-4111-8111-111111111111",
    "trace_id": "aaaaaaaa-aaaa-4aaa-8aaa-aaaaaaaaaaaa",
    "action_type": "update_plan",
    "payload": {
      "plan_description": {
        "goal": "Create a minimal candidate payload",
        "payload_contract": {
          "type": "object",
          "required": [
            "answer"
          ]
        }
      },
      "execution_config": {
        "max_rounds": 3
      },
      "reason": "Initialize the task plan."
    }
  },
  {
    "schema_version": "1.0",
    "action_id": "22222222-2222-4222-8222-222222222222",
    "trace_id": "aaaaaaaa-aaaa-4aaa-8aaa-aaaaaaaaaaaa",
    "action_type": "create_agent",
    "payload": {
      "name": "draft_agent",
      "role": "Produce a candidate answer.",
      "prompt": "Return a concise candidate payload matching the plan contract.",
      "io_schema": {
        "type": "object",
        "required": [
          "answer"
        ],
        "properties": {
          "answer": {
            "type": "string"
          }
        }
      }
    }
  },
  {
    "schema_version": "1.0",
    "action_id": "33333333-3333-4333-8333-333333333333",
    "trace_id": "aaaaaaaa-aaaa-4aaa-8aaa-aaaaaaaaaaaa",
    "action_type": "dispatch",
    "payload": {
      "target_agent_name": "draft_agent",
      "input_source": {
        "type": "variable",
        "data": {
          "question": "What is the minimal accepted output?"
        }
      }
    }
  },
  {
    "schema_version": "1.0",
    "action_id": "44444444-4444-4444-8444-444444444444",
    "trace_id": "aaaaaaaa-aaaa-4aaa-8aaa-aaaaaaaaaaaa",
    "action_type": "accept_output",
    "payload": {
      "decision": "Accept",
      "reason": "The candidate output matches the payload contract."
    }
  },
  {
    "schema_version": "1.0",
    "action_id": "55555555-5555-4555-8555-555555555555",
    "trace_id": "aaaaaaaa-aaaa-4aaa-8aaa-aaaaaaaaaaaa",
    "action_type": "finish",
    "payload": {
      "final_result": {
        "answer": "Accepted candidate payload."
      },
      "summary": "Completed the M1 happy-path trace."
    }
  }
]
